name	title	slot_uri	comments	description	examples	in_subset	keywords	multivalued	pattern	range	recommended	required	string_serialization	structured_pattern	Expected_value	Preferred_unit
biocultural_label	biocultural label	MIXS:999999905		Relevant biocultural labels that apply to the sample under study, based on https://localcontexts.org/label/bc-provenance/. These help indicate how indigenous peoples and similar communities view in which contexts this data can be reused.	{'value': 'BC MC'}	ethics	ethics	True		BioCulturalLabel	False	False			Relevant biocultural label from https://localcontexts.org/labels/biocultural-labels/	
collection_context_name	context name where location was collected	MIXS:999999901		Name of where sample originated and is typically stored. Typically will be 'owning institution'.	{'value': 'Natural History London'}	nucleic acid sequence source	storage	True		string	True	False			name of institution	
cultural_era	cultural era or period	MIXS:999999902		The cultural era approximating the period in which the individual lived from https://chronontology.dainst.org/ or PeriodO if possible. Specify when no value for 'sample_age' is present, or additionally to it. If not available, follow INSDC standard for reporting missing data (https://www.insdc.org/submitting-standards/missing-value-reporting/).	{'value': 'Not collected'}	nucleic acid sequence source	ancient|age	False		string	True	True	{termLabel} [{termID}]|{text}		chronotology or PeriodO term; text	
damage_treatment	Damage treatment type	MIXS:999999903		Indication of whether characteristic ancient DNA damage has been  enzymatically or chemically removed in a laboratory	{'value': 'partial-udg'}	sequencing	ancient	True		DamageTreatmentEnum		True	{float}-{float} {unit}		enumeration	
dna_extraction_date	date of extraction of nucleic acids from sample	MIXS:9999999904		The date when the nucleic acid extraction was started from the sample material. In case no exact time is available, the date can be right truncated i.e. all of these are valid times: 2008-01-23T19:23:10+00:00; 2008-01-23T19:23:10; 2008-01-23; 2008-01; 2008; Except: 2008-01; 2008 all are ISO8601 compliant	{'value': '2023-12-01'}	nucleic acid sequence source				datetime	True	False				
ethical_authority	ethical authority	MIXS:999999905		Name of the authority or institution that awarded sampling and  analysis (e.g. human remains) and/or export permission  (e.g. animal remains)	{'value': 'Federal Foreign Office (Germany)'}	investigation	ethics|location	True		string	True	False			name of authority providing ethical approval	
ethical_date	date of ethical approval	MIXS:9999999906		Date of award of ethical/export permission. The date can be right truncated  i.e. all of these are valid times: 2008-01-23; 2008-01; 2008;  Except: 2008-01; 2008 all are ISO8601 compliant	{'value': '2023-12-01'}	investigation				datetime	True	False				
ethical_id	ethical permit or approval ID	MIXS:999999906		The permissions code, ID, document, or similar provided by any authority  (socal, legal, academic etc.) associated with approval of the analysis of  this particular sample.	{'value': 'DE-123-JK'}	investigation	ethics	True		string	True	False				
ethics_perm_scope	ethical Permissions & Scope	MIXS:999999905		Description of the original scope and permissions of the research on the genetic material, as was approved by the ethical authority (e.g. bacteria only, DNA only, bacteria and human, no host read analysis allowed).	{'value': 'Defined scope only includes the study of bacterial sequences and any human sequence is not covered under the agreement.'}	ethics	ethics	True		string	True	False	{text}		Description of the scope of ethical permissions for data use	
experimental_procedures	experimental procedures	MIXS:999999907		Provide a DOI or URL to refer to the paper where the field report, nucleic acid extraction,  library construction, and other procedures are explained in more detail, e.g. the paper reporting the data.	{'value': 'doi:10.1093/nar/gkr771'}	nucleic acid sequence source		True	^^PMID:\d+$|^doi:10.\d{2,9}/.*$|^https?:\/\/(?:www\.)?[-a-zA-Z0-9@:%._\+~#=]{1,256}\.[a-zA-Z0-9()]{1,6}\b(?:[-a-zA-Z0-9()@:%_\+.~#?&\/=]*)$$	string				{'syntax': '^{PMID}|{DOI}|{URL}$', 'interpolated': True, 'partial_match': True}		
host_body_preservation_state	ancient body preservation state	MIXS:999999905		Description of the state of the sampled (ancient) organism/host as originally preserved in the burial environment, e.g. if the the sample was artificially or naturally (fully/partially) mummified at the time of death.	{'value': 'fully skeletonised.'}	nucleic acid sequence source	ancient	False		string	False	False	{text}		Description of the preservation of the sampled (ancient) organism/host	
lib_concentration	library concentration	MIXS:999999908		Concentration of library in ng per µl, as inferred by qPCR/Qubit/etc.	{'value': '0.5'}	sequencing		True		string			{float}		measurement value in number of ng per µl	
lib_index_polymerase	library index polymerase	MIXS:999999909		The of DNA polymerase enzyme used for indexing DNA libraries	{'value': 'Agilent PfuTurbo Cx HotStart'}	sequencing	polymerase|library|preparation			string	True	False	{text}		name of polymerase used during library indexing	
lib_preparation_protocol	library preparation protocols	MIXS:999999907		Citation(s) for the DNA library preparation protocol	{'value': 'doi:10.1093/nar/gkr771'}	nucleic acid sequence source		True	^^PMID:\d+$|^doi:10.\d{2,9}/.*$|^https?:\/\/(?:www\.)?[-a-zA-Z0-9@:%._\+~#=]{1,256}\.[a-zA-Z0-9()]{1,6}\b(?:[-a-zA-Z0-9()@:%_\+.~#?&\/=]*)$$	string				{'syntax': '^{PMID}|{DOI}|{URL}$', 'interpolated': True, 'partial_match': True}		
lib_reamplification_polymerase	library reamplification polymerase	MIXS:999999909		The name of polymerase enzyme used for reamplifying DNA libraries post-indexing.	{'value': 'KAPA HiFi HotStart Uracil+'}	sequencing	polymerase|library|preparation			string	True	False	{text}		name of polymerase used during library indexing	
lib_strandedness	DNA strandedness in library creation	MIXS:999999905		The strandedness of the original template DNA molecules used for constructing the sequencing library	{'value': 'double'}	sequencing	library|preparation	True		LibStrand	True	False			DNA library strandedness	
lib_type	library type	MIXS:999999910		The type of library created, i.e., amplicon based or shotgun.  Amplicon based, is a library targets a specific region or regions of a genome (e.g. microbial genome capture based on baits of a reference genome), while shotgun refers to non targeted approach.	{'value': 'amplicon'}	sequencing	library|preparation			LibTypeEnum		False				
mid_config	multiplex identifiers or indexing configuration of libraries	MIXS:999999905		Index/barcode/primer configuration used during library building for sequencing. This includes information such as the number, type and location of indexes, the index/primer kit/list, or if 'inline' barcodes or UMIs were ligated directly onto the template molecules.	{'value': 'UDI index sequences.'}	sequencing	library|preparation	True		string	True	False	{text}		Description of the indexing configuration of the library	
neg_cont_status	negative control status	MIXS:999999911		Specify whether the sample is a negative control or not.	{'value': 'True'}	nucleic acid sequence source	control			boolean						
num_capture_amp_cycles	number of reamplification cycles after capture	MIXS:999999912		Number of amplification cycles after capture enrichment	{'value': '12'}	sequencing		True		integer						
num_reamp_cycles	number of reamplification cycles	MIXS:999999913		Number of amplification cycles after library indexing PCR. If capture data, this refers to amplifications prior to the capture experiments.	{'value': '12'}	sequencing				integer						
palaeopath_status	palaeopathology status.	MIXS:999999905		Describe briefly any relevant palaeopathological or health-related observations of the remains of the individual under study.	{'value': 'Caries on right upper molar.'}	nucleic acid sequence source	palaeopathology|host health|ancient	False		string	False	False	{text}		description of health related observation on ancient remains	
preservational_treatment	preservational treatment	MIXS:999999914		Description of any treatment applied to samples for the purpose of  maximising collection preservation that may influence downstream  DNA recovery or library construction, such as storage fluid or  reconstructive glue	{'value': 'stored in formalin'}	nucleic acid sequence source	ancient	True		string			{text}			
prev_pubs	previous publications	MIXS:999999915		Any publications that report data from the same body/skeleton/individual	{'value': 'doi:10.1016/j.jas.2015.02.0181'}	nucleic acid sequence source		True	^^PMID:\d+$|^doi:10.\d{2,9}/.*$|^https?:\/\/(?:www\.)?[-a-zA-Z0-9@:%._\+~#=]{1,256}\.[a-zA-Z0-9()]{1,6}\b(?:[-a-zA-Z0-9()@:%_\+.~#?&\/=]*)$$	string				{'syntax': '^{PMID}|{DOI}|{URL}$', 'interpolated': True, 'partial_match': True}		
probe_set	enrichment probe design description	MIXS:999999905		Description of target enrichment probe designs used (e.g. sequences, type, company). This can include custom kits (please provide a general description and DOI if available) or commercially available kit (provide ID and company).	{'value': 'Commercial kit ABC001-EC from company TE-Science, purchased 2020'}	sequencing	library|enrichment	True		string	False	False	{text}		Description of probe set used for target enrichment/library selection	
recovery_date	date of retrieval from depositional context	MIXS:9999999916		Date of excavation or retrieval from burial or depositional context, if known. In case no exact time is available, the date can be right truncated i.e. all of these are valid times: 2008-01-23T19:23:10+00:00; 2008-01-23T19:23:10; 2008-01-23; 2008-01; 2008; Except: 2008-01; 2008 all are ISO8601 compliant. If excavations were done during a longer period, report its midpoint at a month or year level.	{'value': '2023'}	nucleic acid sequence source				datetime	True	False				year
samp_decontam_pretreat	sample decontamination pretreatment	MIXS:999999917		Method(s) employed for surface decontamination of samples of external  modern DNA; Treatment used on the samples. Depends on the sample type.  More relevant for bones than environmental samples. E.g. buffers, EDTA, etc.	{'value': 'doi:10.1016/j.jas.2015.02.0181'}	nucleic acid sequence source		True	^^PMID:\d+$|^doi:10.\d{2,9}/.*$|^https?:\/\/(?:www\.)?[-a-zA-Z0-9@:%._\+~#=]{1,256}\.[a-zA-Z0-9()]{1,6}\b(?:[-a-zA-Z0-9()@:%_\+.~#?&\/=]*)$$	string				{'syntax': '^{PMID}|{DOI}|{URL}$', 'interpolated': True, 'partial_match': True}		
sample_age	sample age	MIXS:9999999918		The approximate date or date range that individual or organism was living and then died, or the  sample was exposed to the  surface. Typically inferred from archaeological  material, or biological material associated with a sediment, with  radiocarbon dating and other chronometric methods. Should be midpoint of  calibrated radiocarbon age.						string	True	True	{integer}|{integer}-{integer}			
sample_age_inference_methods	sample age inference methods	MIXS:999999919		The method used to infer the sample age. Method (14C, OLS, stratigraphic inference etc.)  and associated information (lab code, etc).	{'value': 'radiocarbon dating, calibrated with OxCal v4.3'}	investigation		True		string	True	False	{text}			
sample_alt_lab_ids	alternative sample IDs	MIXS:999999920		Any alternative sample or material IDs related to the sample not already covered by terms samp_name and source_mat_id, including from associated other non-genetic analyses of the same sample.	{'value': 'ABC_24'}	investigation		True		string			{text}			
storage_conditions	storage conditions	MIXS:999999922		General conditions in which the material (before sampling for DNA analysis) was stored in long-term collection storage, that may influenced DNA recovery or library construction. For example, specify temperature, humidity, presence of microbial overgrowth etc..	{'value': 'Stored at -20oC until dna_extraction_date'}	nucleic acid sequence source				string			{text}			
